{
  "$schema": "https://json-schema.org/draft/2020-12/schema",
  "$id": "https://lectrik0.github.io/data/site.schema.json",
  "title": "Site content",
  "description": "Everything the build renders into the pages. Checked in CI (tests/unit/data.test.mjs), so a bad edit from Backstage fails the build instead of reaching the live site.",
  "type": "object",
  "required": ["profile", "internship", "story", "courses", "skills", "certs", "posts", "cv"],
  "additionalProperties": false,
  "properties": {
    "profile": {
      "type": "object",
      "required": ["name", "tagline", "location", "github", "linkedin", "email", "cv"],
      "additionalProperties": false,
      "properties": {
        "name": { "$ref": "#/$defs/text" },
        "tagline": { "$ref": "#/$defs/text" },
        "location": { "$ref": "#/$defs/text" },
        "github": { "$ref": "#/$defs/httpsUrl" },
        "linkedin": { "$ref": "#/$defs/httpsUrl" },
        "email": { "description": "Needs a valid email address, or leave it empty to hide it.", "anyOf": [{ "const": "" }, { "type": "string", "format": "email" }] },
        "phone": { "description": "Needs a phone number like +20 101 234 5678, or leave it empty to hide it.", "anyOf": [{ "const": "" }, { "type": "string", "pattern": "^\\+?[0-9][0-9 ()-]{5,22}[0-9]$" }] },
        "cveChecker": { "description": "Needs an https:// link, or leave it empty to hide the button.", "anyOf": [{ "const": "" }, { "$ref": "#/$defs/httpsUrl" }] },
        "cv": { "$ref": "#/$defs/link" }
      }
    },
    "internship": {
      "type": "object",
      "required": ["start", "end"],
      "additionalProperties": false,
      "properties": { "start": { "$ref": "#/$defs/date" }, "end": { "$ref": "#/$defs/date" } }
    },
    "story": {
      "description": "One entry per drawn chapter on the home page, so exactly five.",
      "type": "array",
      "minItems": 5,
      "maxItems": 5,
      "items": {
        "type": "object",
        "required": ["title", "text"],
        "additionalProperties": false,
        "properties": { "title": { "$ref": "#/$defs/text" }, "text": { "$ref": "#/$defs/text" } }
      }
    },
    "courses": {
      "type": "object",
      "required": ["university", "degree", "major", "semesters"],
      "additionalProperties": false,
      "properties": {
        "university": { "$ref": "#/$defs/text" },
        "degree": { "$ref": "#/$defs/text" },
        "major": { "type": "string" },
        "semesters": {
          "type": "array",
          "items": {
            "type": "object",
            "required": ["name", "status", "courses"],
            "additionalProperties": false,
            "properties": {
              "name": { "$ref": "#/$defs/text" },
              "status": { "enum": ["completed", "current", "upcoming"] },
              "abroad": { "type": "string" },
              "courses": {
                "type": "array",
                "items": {
                  "type": "object",
                  "required": ["name", "ects"],
                  "additionalProperties": false,
                  "properties": { "name": { "$ref": "#/$defs/text" }, "ects": { "type": "number", "minimum": 0, "maximum": 60 } }
                }
              }
            }
          }
        }
      }
    },
    "skills": {
      "type": "array",
      "items": {
        "type": "object",
        "required": ["group", "note", "color", "items"],
        "additionalProperties": false,
        "properties": {
          "group": { "$ref": "#/$defs/text" },
          "note": { "type": "string" },
          "color": { "enum": ["teal", "blue", "purple", "green"] },
          "items": { "type": "array", "items": { "$ref": "#/$defs/text" } }
        }
      }
    },
    "certs": {
      "type": "array",
      "items": {
        "type": "object",
        "required": ["name", "short", "status"],
        "additionalProperties": false,
        "properties": {
          "name": { "$ref": "#/$defs/text" },
          "short": { "type": "string", "minLength": 1, "maxLength": 7 },
          "icon": { "description": "The picture in the badge; leave it out for text only.", "enum": ["cloud", "blocks", "layers", "gears", "helm", "shield", "award"] },
          "status": { "enum": ["earned", "progress", "planned"] },
          "issued": { "type": "string" },
          "verify": { "description": "Needs an https:// link, like your Credly badge, or leave it empty.", "anyOf": [{ "const": "" }, { "$ref": "#/$defs/httpsUrl" }] }
        }
      }
    },
    "posts": {
      "description": "Write-ups, newest first.",
      "type": "array",
      "items": {
        "type": "object",
        "required": ["title", "date", "tag", "summary", "url"],
        "additionalProperties": false,
        "properties": {
          "title": { "$ref": "#/$defs/text" },
          "date": { "$ref": "#/$defs/date" },
          "tag": { "type": "string" },
          "summary": { "type": "string" },
          "url": { "$ref": "#/$defs/link" }
        }
      }
    },
    "cv": {
      "type": "object",
      "required": ["headline", "summary", "education", "experience", "projects", "skills", "languages"],
      "additionalProperties": false,
      "properties": {
        "fullName": { "type": "string" },
        "headline": { "$ref": "#/$defs/text" },
        "military": { "type": "string" },
        "summary": { "$ref": "#/$defs/text" },
        "education": { "type": "array", "items": { "$ref": "#/$defs/cvEntry" } },
        "experience": { "type": "array", "items": { "$ref": "#/$defs/cvEntry" } },
        "projects": { "type": "array", "items": { "$ref": "#/$defs/cvEntry" } },
        "skills": {
          "type": "array",
          "items": {
            "type": "object",
            "required": ["label", "text"],
            "additionalProperties": false,
            "properties": { "label": { "$ref": "#/$defs/text" }, "text": { "$ref": "#/$defs/text" } }
          }
        },
        "languages": { "type": "array", "items": { "$ref": "#/$defs/text" } }
      }
    }
  },
  "$defs": {
    "text": { "description": "Can't be empty.", "type": "string", "minLength": 1, "pattern": "\\S" },
    "date": { "description": "Needs a date, like 2026-10-04.", "type": "string", "format": "date" },
    "httpsUrl": { "description": "Needs an https:// link.", "type": "string", "pattern": "^https://[^\\s/]+\\.[^\\s]+$" },
    "link": {
      "description": "Needs an https:// link, or a page on this site such as cv.html or writeups/my-lab.html.",
      "type": "string",
      "pattern": "^(https://[^\\s/]+\\.[^\\s]+|(?![A-Za-z][A-Za-z0-9+.-]*:)(?!//)[^\\s]+)$"
    },
    "cvEntry": {
      "type": "object",
      "required": ["title"],
      "additionalProperties": false,
      "properties": {
        "title": { "$ref": "#/$defs/text" },
        "org": { "type": "string" },
        "location": { "type": "string" },
        "dates": { "type": "string" },
        "stack": { "type": "string" },
        "details": { "type": "string" },
        "bullets": { "type": "array", "items": { "$ref": "#/$defs/text" } }
      }
    }
  }
}
