{
 "profile": {
  "name": "Ali Ahmed",
  "tagline": "Cybersecurity student building toward a career in DevOps and cloud engineering.",
  "location": "Cairo, Egypt",
  "github": "https://github.com/Lectrik0",
  "linkedin": "https://www.linkedin.com/in/aliahmed255",
  "email": "aliahmedismail2@gmail.com",
  "phone": "+20 101 954 3773",
  "cveChecker": "https://explain-this-cve.vercel.app",
  "cv": "cv.html"
 },
 "internship": {
  "start": "2026-08-01",
  "end": "2027-01-16"
 },
 "story": [
  {
   "title": "Studying cybersecurity at GIU",
   "text": "Final year of a B.Sc. at the German International University, majoring in IT Security. Networks, operating systems, cryptography, and how all of it breaks."
  },
  {
   "title": "Six months inside a bank",
   "text": "Interning at Ebank, seeing how a financial institution runs its IT and security."
  },
  {
   "title": "Up into the cloud",
   "text": "Studying for AWS Certified Cloud Practitioner. I want to build, ship and run cloud infrastructure: automated, repeatable and reliable."
  },
  {
   "title": "Next steps",
   "text": "AWS Solutions Architect – Associate to learn how systems are designed, then Terraform, AWS CloudOps Engineer and the Certified Kubernetes Administrator."
  },
  {
   "title": "Cloud Security / DevSecOps",
   "text": "Where this road leads."
  }
 ],
 "courses": {
  "university": "German International University (GIU)",
  "degree": "B.Sc. Informatics and Computer Science",
  "major": "IT Security",
  "semesters": [
   {
    "name": "Semester 1",
    "status": "completed",
    "courses": [
     {
      "name": "Mathematics I",
      "ects": 8
     },
     {
      "name": "Programming I",
      "ects": 6
     },
     {
      "name": "Physics",
      "ects": 5
     },
     {
      "name": "Digital Logic Design",
      "ects": 5
     },
     {
      "name": "English for Academic Purposes and Study Skills",
      "ects": 2
     },
     {
      "name": "German 1",
      "ects": 2
     }
    ]
   },
   {
    "name": "Semester 2",
    "status": "completed",
    "courses": [
     {
      "name": "Mathematics II",
      "ects": 4
     },
     {
      "name": "Programming II",
      "ects": 7
     },
     {
      "name": "Computer Networks",
      "ects": 5
     },
     {
      "name": "Theoretical Computer Science",
      "ects": 5
     },
     {
      "name": "Computer Organization",
      "ects": 5
     },
     {
      "name": "Scientific Methods",
      "ects": 2
     },
     {
      "name": "German 2",
      "ects": 2
     }
    ]
   },
   {
    "name": "Semester 3",
    "status": "completed",
    "courses": [
     {
      "name": "Mathematics III",
      "ects": 4
     },
     {
      "name": "Programming III",
      "ects": 7
     },
     {
      "name": "Operating Systems",
      "ects": 5
     },
     {
      "name": "Databases",
      "ects": 6
     },
     {
      "name": "Data Structures & Algorithms",
      "ects": 6
     },
     {
      "name": "Communication and Presentation Skills",
      "ects": 2
     },
     {
      "name": "German 3",
      "ects": 2
     }
    ]
   },
   {
    "name": "Semester 4",
    "status": "completed",
    "courses": [
     {
      "name": "Mathematics IV",
      "ects": 4
     },
     {
      "name": "Software Engineering",
      "ects": 4
     },
     {
      "name": "Analysis and Design of Algorithms",
      "ects": 4
     },
     {
      "name": "Information Security",
      "ects": 4
     },
     {
      "name": "Introduction to Data Science",
      "ects": 4
     },
     {
      "name": "Introduction to Media Informatics",
      "ects": 4
     },
     {
      "name": "Research Paper Writing",
      "ects": 2
     },
     {
      "name": "German 4",
      "ects": 2
     }
    ]
   },
   {
    "name": "Semester 5",
    "status": "completed",
    "abroad": "GIU Berlin, Germany",
    "courses": [
     {
      "name": "Cryptography",
      "ects": 5
     },
     {
      "name": "Software and Mobile Devices Security",
      "ects": 5
     },
     {
      "name": "Digital Forensics",
      "ects": 5
     },
     {
      "name": "Software Project I",
      "ects": 5
     },
     {
      "name": "Machine Learning",
      "ects": 5
     },
     {
      "name": "Database Programming",
      "ects": 5
     }
    ]
   },
   {
    "name": "Semester 6",
    "status": "completed",
    "courses": [
     {
      "name": "Network Security",
      "ects": 6
     },
     {
      "name": "Ethical Hacking and Penetration Testing",
      "ects": 6
     },
     {
      "name": "Business Continuity and Risk Management",
      "ects": 6
     },
     {
      "name": "Project Management",
      "ects": 2
     },
     {
      "name": "Big Data and NoSQL",
      "ects": 6
     },
     {
      "name": "Mobile Software Development",
      "ects": 6
     }
    ]
   },
   {
    "name": "Semester 7",
    "status": "current",
    "courses": [
     {
      "name": "Bachelor Thesis and Colloquium",
      "ects": 20
     },
     {
      "name": "Research Methodology",
      "ects": 5
     },
     {
      "name": "Workplace & Internship Readiness",
      "ects": 5
     }
    ]
   },
   {
    "name": "Semester 8",
    "status": "current",
    "courses": [
     {
      "name": "Internship",
      "ects": 20
     },
     {
      "name": "Internship-accompanying Seminar",
      "ects": 5
     },
     {
      "name": "Business Ethics",
      "ects": 5
     }
    ]
   }
  ]
 },
 "skills": [
  {
   "group": "Comfortable with",
   "note": "Used in coursework and projects.",
   "color": "teal",
   "items": [
    "Networking",
    "Linux",
    "Security fundamentals",
    "Cryptography basics"
   ]
  },
  {
   "group": "Using now",
   "note": "Working knowledge, getting better every week.",
   "color": "blue",
   "items": [
    "Python",
    "AWS core services",
    "Git & GitHub"
   ]
  },
  {
   "group": "Learning next",
   "note": "On the roadmap for the coming months.",
   "color": "purple",
   "items": [
    "Cloud IAM",
    "Terraform",
    "CloudFormation",
    "Cloud logging & detection"
   ]
  }
 ],
 "certs": [
  {
   "name": "AWS Certified Cloud Practitioner",
   "short": "CLF",
   "status": "progress",
   "icon": "cloud"
  },
  {
   "name": "AWS Solutions Architect – Associate",
   "short": "SAA",
   "status": "planned",
   "icon": "blocks"
  },
  {
   "name": "HashiCorp Certified: Terraform Associate",
   "short": "TFA",
   "status": "planned",
   "icon": "layers"
  },
  {
   "name": "AWS Certified CloudOps Engineer – Associate",
   "short": "SOA",
   "status": "planned",
   "icon": "gears"
  },
  {
   "name": "Certified Kubernetes Administrator (CKA)",
   "short": "CKA",
   "status": "planned",
   "icon": "helm"
  }
 ],
 "posts": [
  {
   "title": "Issue #2: Explain This CVE",
   "date": "2026-10-07",
   "tag": "Project",
   "summary": "A one-page CVE checker for managers and analysts: how it works, and the security choices behind it.",
   "url": "writeups/explain-this-cve.html"
  },
  {
   "title": "Issue #1: Hardening a static site",
   "date": "2026-10-04",
   "tag": "Web security",
   "summary": "A site with no backend can still be attacked. How this one blocks XSS with CSP and Trusted Types, and how I tested it.",
   "url": "writeups/hardening-this-site.html"
  }
 ],
 "cv": {
  "fullName": "Ali Ahmed Ismail",
  "headline": "Final-year IT Security student focused on DevOps and cloud engineering.",
  "military": "Postponed (student)",
  "summary": "Final-year IT Security student with hands-on internship experience at a bank in vulnerability management, governance, risk and compliance (GRC), penetration testing and SOC operations. Building toward a career in DevOps and cloud engineering and studying for AWS Certified Cloud Practitioner.",
  "education": [
   {
    "title": "B.Sc. Informatics and Computer Science, IT Security major",
    "org": "German International University (GIU)",
    "dates": "Sep 2023 – Sep 2027",
    "details": "Relevant coursework: Cryptography, Network Security, Ethical Hacking and Penetration Testing, Digital Forensics, Software and Mobile Devices Security, Business Continuity and Risk Management."
   },
   {
    "title": "Exchange semester (5th semester), Cybersecurity",
    "org": "German International University in Berlin (GIU Berlin)",
    "location": "Berlin, Germany",
    "dates": "Sep 2025 – Feb 2026"
   }
  ],
  "experience": [
   {
    "title": "Information Security Intern",
    "org": "Ebank",
    "location": "New Cairo, Egypt",
    "dates": "Aug 2026 – Jan 2027",
    "bullets": [
     "Rotated across the bank's vulnerability management, GRC, penetration testing and SOC teams.",
     "Ran vulnerability scans with Tenable and analyzed the findings by CVE and plugin.",
     "Worked with the GRC team on employee risk assessments aligned with ISO/IEC 27001.",
     "Ran phishing simulations to test employees' security awareness.",
     "Performed internal network penetration tests on each floor of the bank's offices, supervised by the penetration testing team.",
     "Used IBM QRadar (SIEM) with the SOC team to monitor and analyze security events."
    ]
   },
   {
    "title": "Cybersecurity Intern",
    "org": "ICT Misr",
    "location": "Sheikh Zayed, Giza, Egypt",
    "dates": "Jul 2024 (1 month)",
    "bullets": [
     "Shadowed cybersecurity staff in their daily work, learning how businesses apply security in practice.",
     "Observed how the team works with clients and handles their security needs.",
     "Built foundational knowledge of core security concepts, common threat vectors and basic security controls."
    ]
   }
  ],
  "projects": [
   {
    "title": "Explain This CVE: explain-this-cve.vercel.app",
    "stack": "JavaScript, Node.js, Vercel, NVD, CISA KEV, EPSS",
    "dates": "2026",
    "bullets": [
     "Built a CVE checker that turns NVD, CISA KEV and EPSS data into a one-page brief for managers and analysts.",